thumbnail_image_url,title,theatre_name,description,duration_in_seconds,id
les_miserable.jpg,Les Misérables,Sondheim Theatre,"<h2>Les Misérables Information</h2><div><div><div></div><div><section><p>Don’t wait one day more. Head to the barricade. <em>Les Misérables</em> tickets are available on London Theatre now.</p><p>Victor Hugo’s epic French novel of the same name inspires the <em>Les Misérables</em> musical. The musical doesn’t focus on the French Revolution of 1789 though. Instead, <em>Les Misérables</em> tells an expansive story of one man’s journey to salvation from 1815 to 1832.</p><p>After picking up audience buzz at the Barbican, <em>Les Misérables</em> opened at the Palace Theatre on 4 Dec. 1985. Its original cast boasts West End and Broadway talent, including Patti LuPone and Michael Ball.</p><p><em>Les Misérables</em> in London continues to attract audiences, with fans continuing to revisit this dazzling musical that includes such as “I Dreamed a Dream,” “Bring Him Home,” “Empty Chairs at Empty Tables,” and “Do You Hear the People Sing?'</p><p>Audiences worldwide can’t get enough of Jean Valjean’s troubled life. Hugh Jackman, Anne Hathaway, Amanda Seyfried, and Russell Crowe starred in the 2012 Academy Award-nominated <em>Les Misérables</em> film. Plus, it’s been produced across 42 countries and translated into 22 languages. But there's nothing quite like seeing <em>Les Misérables</em>, the West End's longest-running musical, in London.</p><h3>What is <em>Les Misérables</em> about?</h3><p>The <em>Les Misérables</em> musical is set against the backdrop of 19th-century France and tells a moving story of unrequited love, sacrifice, passion, redemption, and revolutionary spirit. The newly-free prisoner Jean Valjean builds a new, respectable life for himself but is hunted by the prison guard Javert, all while revolutionaries fight for freedom in France. Throughout the musical, audiences meet Fantine, Eponine, and Cosette, as well as the Thenardiers, and freedom fighters like Marius and Enjolras.</p><p>Tickets to <em>Les Misérables</em> are available now. Book tickets to <em>Les Misérables</em> on London Theatre today.</p></section></div></div></div>",5400,12
phantom.jpg,The Phantom of the Opera,His Majesty’s Theatre,"<h2>The Phantom of the Opera Information</h2><div><div><div></div><div><section><p>Hear the music of the night at Andrew Lloyd Webber’s sensational, spellbinding musical. <em>The Phantom of the Opera</em> tickets are available on London Theatre now.</p><p><em>The Phantom of the Opera</em> began previews at the then-named Her Majesty's Theatre in London on 27 Sept. 1986, with an original opening night on 9 Oct. 1986. Even though a reworked version opened in 2021, the show boasts memorable music alongside stunning set design, costumes, and special effects.</p><p>A truly romantic tragedy, this beautiful story is set against one of the West End's most memorable scores that includes hit songs such as “The Music of the Night”, “All I Ask of You”, “Think of Me”, and of course, “The Phantom of the Opera”. <em>The Phantom of the Opera</em> musical is one of the most successful pieces of entertainment in history — global audience numbers tally over 130 million people in 145 cities across 27 countries.</p><p>Having spawned a sequel musical <em>Love Never Dies</em> and a successful film adaptation starring Gerard Butler, the glorious production in London's West End continues to draw audiences from all over the world.</p><h3>What is <em>The Phantom of the Opera</em> about?</h3><p>The haunting <em>The Phantom of the Opera</em> musical story is adapted from Gaston Leroux's novel of the same name and is set in the heart of the Paris Opera House. As young ballet dancer Christine Daae becomes the object of The Phantom's secret affection, he manipulates her career at the expense and horror of the Opera House staff and stars.</p><h3>Where is <em>The Phantom of the Opera</em> playing in the UK?</h3><p><em>The Phantom of the Opera</em> is currently playing at (previously Her Majesty's Theatre) in London. The production began performances on 27 September 1986 and is the second longest-running musical in the West End.</p><p>Tickets to <em>The Phantom of the Opera</em> are available now. Book your <em>The Phantom of the Opera</em> tickets on London Theatre today.</p></section></div></div></div>",15120,13
tina.jpg,Tina - The Tina Turner Musical,Aldwych Theatre,"<h2>Tina - The Tina Turner Musical Information</h2><div><div><div></div><div><section><p>Discover how the Queen of Rock and Roll took over the world at simply the best musical in town. <em>Tina: The Tina Turner Musical</em> tickets are available on London Theatre now.</p><p>You may already be familiar with Tina Turner's life story. But no show tells it quite like this. Her story was first presented to audiences in the 1993 autobiographical film, <em>What's Love Got to Do with It?</em>. Angela Bassett and Laurence Fishburne played the musical pair on screen. In 2012, her life was immortalised in the <em>Soul Sister</em> musical.</p><p>But if you’re looking for a fuller picture of what it's like to live in and out of the public eye, you need to see <em>Tina - The Tina Turner Musical</em> in London. The formidable artist was involved with the show’s creation, teaming up with director Phyllida Lloyd for how to present her story best.</p><p>During the show, you’ll hear dozens of her greatest hits, as well as Motown classics. Listen out for all the crowdpleasers, like 'What's Love Got to Do With It,' 'Proud Mary.' “River Deep Mountain High,' and 'Better Be Good To Me.' </p><h3>What is <em>Tina - The Tina Turner Musical</em> about?</h3><p>Born as Anna Mae Bullock on 26 Nov. 1939 in Nutbush, Tennessee, the recording artist shot to fame in the mid-1950s singing with Ike Turner's Kings of Rhythm. She originally went under the name 'Little Ann”, but in 1960, Ike Turner gave her the moniker “Tina Turner.” The musical charts Tina's life away from the public eye too, notably how Tina split from Ike Turner in 1976 after being a victim of domestic abuse. Nowadays, Tina Turner lives in Küsnacht, Switzerland.</p><p>Tickets to <em>Tina: The Tina Turner Musical</em> are available now. Book your <em>Tina: The Tina Turner Musical</em> tickets on London Theatre today.</p></section></div></div></div>",16740,14
guys.jpg,Guys & Dolls - Standing Immersive,Bridge Theatre,"<h2>Guys &amp; Dolls - Standing Immersive Information</h2><div><div><div></div><div><section><p>Sit down, or stand, at a striking immersive musical taking over the Bridge Theatre. <em>Guys and Dolls</em> tickets are available on London Theatre now.</p><p></p><p>London loves <em>Guys &amp; Dolls</em>. The musical first came to the West End in 1953, with Queen Elizabeth II even enjoying the show. This stylish version combines Golden Age Hollywood glamour with a 21st-century reinvention. With standing tickets, you’ll be swept to Manhattan and Havana all in one night.</p><p>London Theatre couldn’t stop shouting about the show, saying: “ “You’ve simply gotta gamble”. And when it pays off, as [director Nicholas] Hytner proves, the rewards are boundless.”</p><p>When Manhattan gambler Nathan Detroit needs to find a new location for his crap shooting games, he calls upon Sky Masterson. The pair settle on a bet: Nathan bets Sky that he can’t take a woman of his choosing on a date. Everything changes when they meet Salvation Army sergeant Sarah Brown.</p><h3>What songs are in <em>Guys &amp; Dolls</em>?</h3><p>The <em>Guys &amp; Dolls</em> musical includes Frank Loesser’s jazzy score, including “Luck Be a Lady, “Sit Down, You’re Rocking the Boat,” “A Bushel and a Peck,” and “Adelaide’s Lament.” Listen to cast members Cedric Neal, Marisha Wallace, Daniel Mays, and Celinde Schoenmaker perform the hits.</p><p>Tickets to <em>Guys and Dolls</em> are available now. Book your <em>Guys and Dolls</em> tickets on London Theatre today.</p></section></div></div></div>",14400,15
sister.jpg,Sister Act ,Dominion Theatre,"<h2>Sister Act  Information</h2><div><div><div></div><div><section><p>This is fabulous, baby! Beverley Knight and Alexandra Burke will star in <em>Sister Act</em> at the Dominion Theatre. <em>Sister Act</em> tickets are available on London Theatre now.</p><p>The <em>Sister Act</em> musical follows Deloris Van Cartier, a lounge singer who is forced to join a convent as part of a witness protection programme. As she spends time with her fellow nuns of Saint Katherine's Convent, Deloris inspires the women to raise their voices, stand tall, and sing out loud and proud.</p><p>Whoopi Goldberg originated the role of Deloris Van Cartier in the 1992 <em>Sister Act</em> film, and the musical comedy became one of the most successful movies of the early 1990s. Alan Menken later adapted <em>Sister Act</em> into a musical in 2009, with gospel-infused songs such as “Take Me To Heaven”, “How I Got the Calling”, “Raise Your Voice” and “Spread the Love Around”.</p><p><em>Sister Act</em> returned to London in 2022, with Beverley Knight, Jennifer Saunders, Keala Settle, Lesley Joseph, and Clive Rowe in tow. In a , our critic said: “It’s a classic, jubilant story of the power of community and coming together set to rollicking music and full of humour and dancing. Tim Mitchell’s lighting makes you feel like you’re at a gospel concert.”</p><h3>Who is in the <em>Sister Act</em> musical cast?</h3><p>The <em>Sister Act</em> musical cast will star Beverley Knight and Alexandra Burke as Deloris van Cartier. Knight will play Deloris from 15 March to 8 Jun. 2024. Burke will play Deloris from 10 June to 31 Aug. 2024. The pair previously played Deloris in past iterations of <em>Sister Act</em>: Knight led the Eventim Apollo cast in 2022, and Burke played the lounge singer for the musical’s national tour in 2016.</p><p>Tickets to <em>Sister Act</em> are available now. Book your <em>Sister Act</em> tickets on London Theatre today.</p></section></div></div></div>",7200,16
jersey.jpg,Jersey Boys,Trafalgar Theatre,"<h2>Jersey Boys Information</h2><div><div><div></div><div><section><p>Oh, what a night you'll have with Frankie Valli and the Four Seasons. <em>Jersey Boys</em> tickets are available on London Theatre now.</p><p>Spring, summer, autumn, or winter, the West End can’t get enough of this Four Seasons musical. <em>Jersey Boys</em> previously played in the West End for nine years and won an Olivier Award for Best New Musical. Now, it’s the first show to play at the Trafalgar Theatre, a stylish West End hotspot.</p><p>Hear all your favourite soulful songs in this Frankie Valli and the Four Seasons jukebox musical. As well as 'December 1963 (Oh What A Night),' you’ll want to sing along to 'Can’t Take My Eyes Off You,' 'Sherry,' 'Walk Like A Man,' 'Bye Bye Baby,' 'Big Girls Don’t Cry,' and many more. Original Jersey Boy Bob Gaudio worked on the musical, collaborating with book writers Marshall Brickman and Rick Elice, and lyricist Bob Crewe.</p><h3>What is the <em>Jersey Boys</em> musical about?</h3><p>How did Frankie Valli and the Four Seasons take over the world? At the start, they were just four ordinary guys from New Jersey until they sang their very first note. People started talking. They had a sound nobody had ever heard … and the radio just couldn’t get enough of it. While their harmonies were perfect on stage, off stage it was a very different story — a story that has made them an international sensation all over again.</p><p>Tickets to <em>Jersey Boys</em> are available now. Book your <em>Jersey Boys</em> tickets on London Theatre today.</p></section></div></div></div>",10800,17
old.jpg,Stephen Sondheim’s Old Friends,Gielgud Theatre,"<h2>Stephen Sondheim’s Old Friends Information</h2><div><div><div></div><div><section><p>See the return of this magnificent concert honouring the late great American composer Stephen Sondheim. <em>Stephen Sondheim’s Old Friends</em> tickets are available on London Theatre now.</p><p><em>Old Friends</em> will play for 16 weeks only at the Gielgud Theatre. Look forward to hearing many of Sondheim’s most beloved and multi-layered tunes in this homage to the admired composer and lyricist. Anticipate listening to songs from some of his most distinguished musicals, such as <em>Sunday in the Park With George</em> and <em>Sweeney Todd</em>. </p><p>Join Broadway leading ladies Bernadette Peters and Lea Salonga as they perform some of the most iconic Sondheim songs. Peters has frequently collaborated with Sondheim for many of his shows, including originating roles in <em>Sunday in the Park With George</em> and <em>Into the Woods</em>. Salonga, who has more recently starred on Broadway in <em>Here Lies Love</em> will return to the West End stage for the first time in over twenty-seven years.</p><p>The concert was originally intended as a one-night-only gala in 2022, selling out in two hours. Due to the overwhelming demand, producer Cameron Mackintosh is bringing the award-winning concert back to the West End stage for audiences to have another chance to see one of the most poignant tributes to a man who changed musical theatre forever.</p><p>Matthew Bourne and Julia McKenzie will direct the star-studded concert, joined by choreographer Stephen Mear, conductor Alfonso Casado Trigo, musical supervisor Stephen Brooker, set designer Matt Kinley, projection designer George Reeve, costume designer Jill Parker, lighting designer Warren Letton, sound designer Mick Potter, with musical arrangements by Stephen Brooker.</p><h2>Who will perform in <em>Stephen Sondheim’s Old Friends</em></h2><p><em>Old Friends</em> will see Bernadette Peters (<em>Hello, Dolly!, Annie Get Your Gun</em>) returning to perform in the concert, joined by Lea Salonga (<em>Miss Saigon, Les Miserables</em>).</p><p>West End stars Christine Allado, Janie Dee, Bonnie Langford, Joanna Riding, Jeremy Secomb, Jac Yarrow, Marley Fenton, Beatrice Penny-Touré, Haydn Gwynne, Damian Humbley, Bradley Jaden, Gavin Lee and Jason Pennycooke, Harry Apps, Bella Brown, and Monique Young.</p><p>Tickets to <em>Stephen Sondheim’s Old Friends</em> are available now. Book your <em>Stephen Sondheim’s Old Friends</em> tickets on London Theatre today.</p></section></div></div></div>",3600,18
little_big.jpg,The Little Big Things,Soho Place,"<h2>The Little Big Things Information</h2><div><div><div></div><div><section><p>Witness Henry Fraser’s Sunday Times bestselling autobiography, <em>The Little Big Things</em>, come to life in its stage musical debut, and see how one moment can change somebody's life forever. Book The Little Big Things tickets on London Theatre now.</p><p>Henry was an avid sportsman when a life-altering diving accident made him tetraplegic, forcing him and his family to learn to live in a completely new way. Henry surpassed expectations through a remarkable blend of courage and resilience, achieving a swift discharge from the hospital a full year ahead of projections. Refusing to succumb to the devastating odds stacked against him, he is now a hugely successful artist, inspirational speaker, and bestselling author.</p><p>Director Luke Sheppard (<em>&amp; Juliet</em>, <em>My Son's a Queer</em>) leads <em>The Little Big Things</em> musical, which serves as a powerful reminder to cherish every aspect of life. With Nick Butcher's unforgettable pop theatrical score, <em>The Little Big Things</em> has leapt from the page to the Soho Place stage in a phenomenal way.</p><p><em>The Little Big Things</em> in London stars Ed Larkin as Adult Henry Fraser and Jonny Amies as Boy Henry Fraser, with Linzi Hateley (<em>Joseph and the Amazing Technicolour Dreamcoat</em>, <em>Mamma Mia!</em>) and Alasdair Harvey (<em>Come From Away</em>, <em>We Will Rock You</em>) as his parents. Be among the first to witness this awe-inspiring true story at Soho Place in London.</p><p>Tickets to Little Big Things are available now. Book your Little Big Things tickets on London Theatre today.</p></section></div></div></div>",5400,19
choir.jpg,The Choir of Man,Arts Theatre,"<h2>The Choir of Man Information</h2><div><div><div></div><div><section><p>The International sensation and feel-good show <em>The Choir of Man</em> brings 80 minutes of unadulterated escapism and pure fun to London's West End. <em>The Choir of Man</em> tickets are available on London Theatre now.</p><p>Nic Doodson and Andrew Kay’s creation became an instant classic. After performances at the Edinburgh Festival Fringe in 2017, the show was licensed for performance at sea by Norweigan Cruise lines. Quickly, <em>The Choir of Man</em> musical gained fans around the world. Now, it’s taking over the West End, picking up an Olivier nomination for Best Entertainment or Comedy Play.</p><h3>What is <em>The Choir of Man</em> about?</h3><p><em>The Choir of Man</em> is a great night at your local pub brought to glorious musical life on stage. Nine talented performers deliver reinventions of your favorite chart-topping classics, with songs by Adele, Guns'N'Roses, Sia, and Paul Simon among the disparate numbers, all brought to roaring life.</p><p>Fresh harmonies mean you'll hear classic songs like you've never heard them before, mixed with meditations on community and resilience delivered in-between rip-roaring musical numbers. It's like no pub concert you've ever seen before.</p><p>The show's set also includes a working bar. <em>The Choir of Man</em> London audiences are welcome on stage to grab a pint and meet the boys before the show begins. A few lucky audience members might even be pulled up on stage during the show to experience a number up close. Wherever you are sitting, the musical's tap dancing and exuberant stomping is choreography like nothing you've experienced on the West End.</p><p>Tickets to <em>The Choir of Man</em> are available now. Book your <em>The Choir of Man</em> tickets on London Theatre today.</p><p><strong>Assisted performance</strong></p><p>Captioned performance: 14th September 2023 7:30pm</p></section></div></div></div>",15120,20
candellight.jpg,Musicals by Candlelight ,The Actors' Church,"<h2>Musicals by Candlelight Information</h2><div><div><div></div><div><section><p>After sell-out concerts, <em>Musicals by Candlelight</em> returns for a second year in London. Unwind with classical renditions of musical theatre songs and celebrate the power of musicals in tranquil surroundings. <em>Musicals by Candlelight</em> tickets are available on London Theatre now.</p><p>The 60-minute candlelight concerts showcase legendary musical compositions by some of the world’s greatest musical theatre writers, including , , and more. Plus, it’s a chance to hear the world-class collective, Icon Strings Quartet, in action. They’ve previously performed at the Royal Albert Hall and the Royal Opera House. Now’s your chance to catch the acclaimed musicians up close and personal.</p><p>During the London candlelight concerts, expect to hear songs from <em>Chicago</em>, <em>Dirty Dancing</em> and <em>Grease</em>. Listening to candlelight music will most likely be an emotional experience, so pack your tissues. </p><h3>Where are <em>Musicals by Candlelight</em> performances?</h3><p><em>Musicals by Candlelight</em> London performances will take place at The Actor’s Church, an intimate space in Covent Garden with historical ties to the West End from as early as the 1600s.</p><p>Tickets to <em>Musicals by Candlelight</em> are available now. Book your <em>Musicals by Candlelight</em> tickets on London Theatre today.</p></section></div></div></div>",16740,21
rebecca.jpg,Rebecca,Charing Cross Theatre,"<h2>Rebecca Information</h2><div><div><div></div><div><section><p>See the chilling musical adaptation of the classic Daphne du Maurier novel <em>Rebecca</em> at the Charing Cross Theatre. Book <em>Rebecca</em> tickets on London Theatre today.</p><p>When the widowed Maxim de Winter's new bride moves into his grand estate, she quickly realises that the memory of his first wife, Rebecca, still haunts the minds and grounds of Manderley. Mrs Danvers, the manipulative housekeeper, seems particularly resentful of the new Mrs de Winter.</p><p>As Mrs de Winter tries to settle into her new life, she becomes entangled in the dark secrets surrounding Rebecca’s mysterious death. <em>Rebecca</em> is a suspenseful tale of jealousy and mystery that will keep you on the edge of your seat.</p><p>An orchestra of eighteen brings Michael Kunze and Sylvester Levay’s score to life. Kunze and Levay stand out as one of the most accomplished German-language musical composing duos, renowned for their collaborations on productions such as <em>Elisabeth, Mozart!</em>, and <em>Marie Antoinette</em>.</p><p>Rebecca premiered in Vienna, Austria, in 2006, quickly becoming an instant hit. With translations into eight languages across twelve countries, the Charing Cross production will mark the English-language debut of <em>Rebecca</em>. Other adaptations of du Maurier’s book include the Academy Award-winning 1940 Alfred Hitchcock movie and the recent Netflix adaptation in 2020 starring Lily James and Armie Hamer.</p><h3>Is <em>Rebecca</em> based on a book?</h3><p>Yes, <em>Rebecca</em> is based on Daphne du Maurier’s 1938 novel of the same name. The book became a bestseller that has kept readers riveted for decades, from its iconic first line — “Last night I dreamt I went to Manderley again” — to its last twist.</p><p><em>Rebecca</em> tickets are available on London Theatre now. Book your <em>Rebecca</em> tickets on London Theatre today.</p></section></div></div></div>",10800,22
broneo.jpg,Bronco Billy The Musical,Charing Cross Theatre,"<h2>Bronco Billy The Musical Information</h2><div><div><div></div><div><section><p><em>Bronco Billy – The Musical</em> makes its London debut at the Charing Cross Theatre in January 2024. Book <em>Bronco Billy – The Musical</em> tickets now on London Theatre.</p><p>The year is 1979, and a band of travelling Wild West performers skilled in sharpshooting, trick riding, and disco dancing face the challenges of their nomadic lifestyle. Their world is turned on its head when Bronco Billy, their charismatic leader, crosses paths with Antoinette Lilly, a determined heiress from Manhattan who is on the run. <em>Bronco Billy – The Musical</em> is an uplifting show about love, reinvention, family, and pursuing one’s dreams.</p><p>Directed by Hunter Bird, the U.K. premiere of <em>Bronco Billy – The Musical</em> is led by Emily Benjamin as the runaway heiress, Antoinette. She is known for alternating the role of Sally Bowles in <em></em> at the Kit Kat Club. She stars alongside Tarinn Callender (<em>, The Drifters Girl</em>) as Bronco Billy and Victoria Hamilton-Barritt (<em>Hex</em>) as Constance.</p><p>The musical has a book written by Dennis Hacklin, with music and lyrics by Chip Rosenbloom and John Torres. Michele Brourman provides additional lyrics.</p><p>Before its U.K. debut, the musical premiered at the Skylight Theatre in Los Angeles in 2019. The Los Angeles Times raved: “The tone playfully artificial, but the material, cotton-candyish as it is, manages to tug at the heartstrings with its notions about dreamers intent on making their lives — and, possibly, the world — a little bit better.”</p><p><em>Bronco Billy – The Musical</em> in London is a thrilling musical you won’t want to miss. Book tickets for <em>Bronco Billy – The Musical</em> on London Theatre.</p></section></div></div></div>",3600,23
flowers.jpg,Flowers for Mrs. Harris,Riverside Studios,"<div><div><div></div><div><section><p>For Ada Harris, day-to-day life is spent cleaning houses. But one day when she is working for a wealthy client in Belgravia, she happens upon a Dior dress that takes her breath away.</p><p>In that magical moment, Ada has an epiphany and sets off on a journey that will change her life... From the cobbled streets of post-war London to the magical avenues of Paris and beyond, Ada transforms the lives of everyone she meets along the way, but can she let go of her past and finally let her own life blossom?</p><p>Olivier Award-winning legend <strong>Jenna Russell</strong> leads a twelve-strong company in the London premiere of the heart-warming and critically acclaimed musical, <em>Flowers For Mrs Harris</em>.</p></section></div></div></div>",15120,24